{
  "$schema": "https://json-schema.org/draft/2020-12/schema",
  "$id": "kc-plan-detail/v1",
  "title": "kc-plan-detail v1",
  "description": "How to build it. Sub-issues cut against archaeology findings, written in the form plan-lint reads, plus the lint result they were judged by.",
  "type": "object",
  "additionalProperties": false,
  "required": [
    "schema",
    "value_issue",
    "archaeology",
    "sub_issues",
    "lint"
  ],
  "properties": {
    "schema": {
      "const": "kc-plan-detail/v1"
    },
    "value_issue": {
      "type": "string",
      "minLength": 1
    },
    "archaeology": {
      "type": "array",
      "items": {
        "type": "object",
        "additionalProperties": false,
        "required": [
          "question",
          "classification",
          "ref",
          "command",
          "evidence"
        ],
        "properties": {
          "question": {
            "type": "string",
            "minLength": 1
          },
          "classification": {
            "enum": [
              "WORKING",
              "WORKING_UNIT_UNPROVEN",
              "EXISTS_BROKEN",
              "STUB",
              "MISSING",
              "LOCATED"
            ]
          },
          "ref": {
            "type": "string",
            "minLength": 1
          },
          "command": {
            "type": "string",
            "minLength": 1,
            "description": "The command that produced the finding. Without it the classification is an opinion."
          },
          "evidence": {
            "type": "string",
            "minLength": 1,
            "description": "What the command returned, in enough detail to be disagreed with."
          },
          "stratum": {
            "type": "string",
            "minLength": 1,
            "description": "Which ref carries it and that ref's relation to the trunk. A thing on a closed branch is not a thing that exists."
          },
          "absence_proof": {
            "type": "string",
            "minLength": 1,
            "description": "Required in spirit for every MISSING: both searches that bound the claim."
          },
          "did_not_check": {
            "type": "array",
            "items": {
              "type": "string",
              "minLength": 1
            },
            "description": "The question's edges. Dropping these is how a bounded finding becomes an unbounded belief."
          }
        }
      },
      "description": "The archaeologist's findings kept whole rather than summarised. Three fields once survived here -- question, classification, ref -- and the commands, evidence, absence proofs and stated limits were discarded, so every planning session re-excavated what the last one had already established."
    },
    "sub_issues": {
      "type": "array",
      "minItems": 1,
      "items": {
        "type": "object",
        "additionalProperties": false,
        "required": [
          "title",
          "gap",
          "accepted_outcome",
          "acceptance",
          "non_goals",
          "supersedes",
          "estimate",
          "estimate_basis"
        ],
        "properties": {
          "title": {
            "type": "string",
            "minLength": 1
          },
          "gap": {
            "type": "string",
            "minLength": 1
          },
          "accepted_outcome": {
            "type": "string",
            "minLength": 1
          },
          "acceptance": {
            "type": "array",
            "minItems": 1,
            "items": {
              "type": "string",
              "pattern": "^- \\*\\*AC-\\d+\\s*\\*\\* "
            }
          },
          "non_goals": {
            "type": "array",
            "minItems": 1,
            "items": {
              "type": "string",
              "minLength": 1
            }
          },
          "re_verified": {
            "type": "string",
            "pattern": "^[^:]+ \\d{4}-\\d{2}-\\d{2}$",
            "description": "Command then ISO date, no colon and no issue identifier. Optional in the body: a verification record is process rather than acceptance, and plan-lint reads the comment thread too. What belongs in the body is the conclusion -- which surfaces are involved -- because the grep that found them ages at the speed of the codebase, and whoever picks the work up re-derives it anyway."
          },
          "supersedes": {
            "type": "string",
            "minLength": 1
          },
          "estimate": {
            "type": "integer",
            "minimum": 1,
            "maximum": 13,
            "description": "Fibonacci points, on the technical work only. It answers exactly one question -- whether a milestone fits before its date -- and is not a velocity, a commitment, or a measure of anyone. A value issue carries none: it has no work of its own, so estimating it double-counts its children."
          },
          "estimate_basis": {
            "enum": [
              "judgement",
              "calibrated"
            ],
            "description": "Where the number came from. 'judgement' is a reading of the ticket and orders work; it cannot promise a date. 'calibrated' means a reference class was measured -- finished tickets of this kind, their real change size and the time from starting to reviewable -- and the scale adjusted against it. The first plan to carry estimates reported 34 points against a three-day milestone with no calibration behind any of them, which reads as arithmetic and was a guess."
          },
          "depends_on": {
            "type": "array",
            "items": {
              "type": "string",
              "minLength": 1
            },
            "description": "Titles of sub-issues under the same value that must land first. This is what makes 'the topmost sub-issue' answerable -- the rule about who owes a handoff needed an order no step produced."
          }
        }
      }
    },
    "lint": {
      "type": "object",
      "additionalProperties": false,
      "required": [
        "result",
        "unjudged",
        "known_limits"
      ],
      "properties": {
        "receipt": {
          "type": "string",
          "pattern": "^[0-9a-f]{16,64}$",
          "description": "The receipt the linter produced, once there is something to lint. Absent on a first projection and filled on the run after: the issues have to exist before they can be judged, and requiring it up front made the documented loop impossible to complete on its first pass."
        },
        "result": {
          "enum": [
            "PASS",
            "FAIL",
            "not-yet-linted"
          ],
          "description": "`not-yet-linted` is the honest state of a document whose issues have not been created. It is not a pass and it is not a failure; treating it as either is how an unlinted plan gets quoted as a linted one."
        },
        "unjudged": {
          "type": "array",
          "items": {
            "type": "string",
            "minLength": 1
          }
        },
        "known_limits": {
          "type": "array",
          "items": {
            "enum": [
              "L2-single-cycle",
              "L9-value-issue-has-no-file-surface"
            ]
          },
          "description": "Rules a plan of this shape cannot pass. Naming one here is the report; contorting the plan to pass it is not."
        }
      }
    }
  }
}
