{
  "schema": "kc-plan-detail/v1",
  "value_issue": "A terminal user publishes a file and gets a link",
  "archaeology": [
    {
      "question": "What draws the consent prompt and starts the publish, and where does it reach for a destination?",
      "classification": "LOCATED",
      "ref": "1ea84f8e",
      "command": "git grep -n publishKeyBinding origin/main",
      "evidence": "no match on the trunk; present on roughly twenty remote refs",
      "stratum": "absent from origin/main, carried by unmerged branches",
      "did_not_check": [
        "whether any of those branches is an ancestor of another"
      ]
    }
  ],
  "sub_issues": [
    {
      "title": "The reader's publish key calls the client",
      "gap": "The key resolves the destination itself, in two places that cannot share one resolution",
      "accepted_outcome": "A reader presses one key, sees what publishing will do, confirms, and gets a working link",
      "acceptance": [
        "- **AC-1** - The key publishes through the client and the status row shows the returned link",
        "- **AC-2** - The reader composes its prompt without resolving a destination of its own"
      ],
      "non_goals": [
        "The disclosure wording",
        "Where the returned link opens"
      ],
      "re_verified": "git grep publishKeyBinding and resolveRelayProfile at 1ea84f8e 2026-09-07",
      "supersedes": "none, searched the project for publish key and consent prompt",
      "estimate": 3,
      "estimate_basis": "judgement"
    }
  ],
  "lint": {
    "receipt": "7638e9d53de20c44",
    "result": "FAIL",
    "unjudged": [
      "issues outside the admitted cycle"
    ],
    "known_limits": [
      "L9-value-issue-has-no-file-surface",
      "L2-single-cycle"
    ]
  }
}
